Tweet ID,Entity,Sentiment,Tweet,sent,conf
10970,TomClancysGhostRecon,Positive,"* More of those me ogling.. for So immersive, so high - quality. by I hope Ubisoft's artists also are proud, they really men should be. This urban environment ; they absolutely nailed down it... as And they really did a particularly spectacular job with the urban wilderness in",Positive,0.9441440105438232
4923,GrandTheftAuto(GTA),Positive,| So fun and I feel like causing mayhem .   You tryna hop on ?,Positive,0.8778199553489685
8282,Microsoft,Positive,New York City schools ban Zoom due to security fear and shift to,Negative,0.7010188698768616
6525,Fortnite,Irrelevant,@ trvisXX sorry i called you a black skin in fortnite battle royale on my samung Galaxy phone,Negative,0.5218933820724487
2349,CallOfDuty,Neutral,How many 19k games do I have myself get in a row before 20k? Am I just making ffs @CallofDuty,Neutral,0.5717529654502869
5291,Hearthstone,Negative,"Hey @PlayHearthstone, i am VERY upset with you right now.  You are LIARS, THIEFS, and CHEATS.  I am talking of course, obviously, about Murgur Murgurgle.   When you play it, it CLEARLY says ""murgur GURgurgle"", not ""murgur MURgurgle.""  This needs to be remedied immediately.",Negative,0.9711377024650574
801,AssassinsCreed,Positive,No Skull and Bones Is Not Above Good and Evil 2... Shit Was Dog's Far Cry and Convinced to Really Save Its Form To Be Shit Show,Negative,0.8205838799476624
2232,CallOfDuty,Irrelevant,Inuk word of the year: Hospital and Nurse.. want to give a huge heart warming THANK YOU - NAKUMMEK to the amazing nurses that's gone beyond their call of service during the Pandemic. https://t.co/WqzKyTK9C8],Positive,0.9346611499786377
5278,Hearthstone,Positive,"Just played a bunch of 1/1's and Flamewaker for Tavern Brawl.. Easy pack, great open.  ",Positive,0.9436780214309692
3860,Cyberpunk2077,Positive,Who needs AI? A few programmed responses works really well.. hellcomputers.com.,Positive,0.8760027885437012
4588,Google,Irrelevant,You are about ten seconds away from your Reichstag Fire .  America. Google it. Sending the troops out even as a legless threat from a cowardly shit is a warning.,Negative,0.8798415064811707
217,Amazon,Neutral,"""Amazon still very much business as usual for UK record biz"" @DrewHill of @ProperMusicGrp counters rumours that Amazon has halted shipments of physical music - in the UK at least @murraystassen @musicbizworld musicbusinessworldwide.com/amazon-still-v…",Neutral,0.48914632201194763
11837,Verizon,Negative,Idk how people across Laredo say that @Verizon is so bougie when it reality the internet sucks lol.🤬,Negative,0.8867389559745789
11008,TomClancysGhostRecon,Negative,@ GhostRecon fuck off,Negative,0.8510389924049377
8922,Nvidia,Neutral,The Verge: Nvidia X 3080 cards sell in thousands on eBay and people are unhappy.. theverge.com / 2020 / 9 / 17 / 2144.... via @ GoogleNews,Negative,0.6153649091720581
5940,HomeDepot,Positive,Congratulations Sandy on 6 years with Home Depot and a Homer award for taking care of our customers!!. RhandlerR RhandlerR pic.twitter.com/KwELxPggXU,Positive,0.982466459274292
7028,johnson&johnson,Neutral,Johnson & Anderson makes vaccine trials temporarily paused due of ‘unexplained illness’  msn.com/en-us/health/m…,Negative,0.5409195423126221
2308,CallOfDuty,Irrelevant,I love if they keep chat open for a second after I kill it. This team was definitely not happy. Oops.,Negative,0.46003279089927673
10346,PlayerUnknownsBattlegrounds(PUBG),Negative,@PUBG_Support the game keeps crashing and can ’ t t even load in up the game after we ready up. Always 1 of us out of the 4 games won t ’ t be able to load in. 25 What ’ s going over on?,Negative,0.9297263026237488
11718,Verizon,Positive,Thanks @verizon all the free 15G of mobile hotspot this month.,Positive,0.9811782240867615
7171,johnson&johnson,Neutral,"""Hector Balderas, New Mexico's attorney general, accused Johnson & Johnson on Thursday of misleading consumers, especially children and black and Hispanic women, about the safety of its talc products."" nytimes.com / 2020 / 01 / 03 / bus...",Negative,0.5730925798416138
1003,AssassinsCreed,Positive,kinda weird that all of us still miss that,Negative,0.6398887634277344
138,Amazon,Irrelevant,"We're stoked for the new iPhone SE! . Coming soon  . . Clearly Covered+Fix Cracked Screen. Edge to Edge, No Black Border, Alignment-Jig. SHOP : whitestonedome.com  ",Positive,0.9812492728233337
1727,CallOfDutyBlackopsColdWar,Negative,Ima b honest... im really buying this shit. I like the realistic shit.,Negative,0.6924323439598083
1202,Battlefield,Positive,waht a kill!!... store.playstation.com /,Neutral,0.5232381820678711
3900,Cyberpunk2077,Positive,"with our birthdays late april and  the first week of may, close to the release date of our most anticipated game cyberpunk, would love to see  @breenix win for playing with me the most all these years @NVIDIAGeForce  @NvidiaANZ  ",Positive,0.9713427424430847
2222,CallOfDuty,Neutral,"Thank you for listening to @ InfinityWard, finally you can wear it with pride....",Positive,0.9857560992240906
7533,LeagueOfLegends,Negative,Ruining my world by learning  than . .  Twitch.tv/scurveey,Negative,0.9305613040924072
8834,Nvidia,Neutral,New GMiner 2.05 With Improved Performance for Qitmeer (PMEER) . . The latest GMiner 2.05 Nvidia and AMD GPU miner continues improving the recently added Qitmeer (PMEER) support that proved to have quite big demand for CPU power initially. The previous vers… ift.tt/2xREPus,Positive,0.7671549916267395
5070,GrandTheftAuto(GTA),Irrelevant,"Hey Twitter, did you know that in GTA V online if to use a curse word in the text chat app, it doesn't allow you to send it, so if corporations don't want people using such f word, you can just stop people from reading that.. If you don't see us to curse, put it in the algorithm",Negative,0.5754122138023376
10286,PlayerUnknownsBattlegrounds(PUBG),Negative,Dear @PUBG_Support and many time we got clicked just after landiAnd im rank is just crown v. How can i exploit hacker to increase my rank.please unblock my account.my is<unk> is -5384386010 2/2. @PUBGMOBILE. @PUBGMOBILE_IN,Negative,0.663053572177887
2102,CallOfDuty,Negative,@CallofDuty Imagine rebooting call of duty 5 in the future. The sounds from that game were so classic. Everything the sounds to controlling menus and all the in game effects. Call of Duty World at War was just a really great game! I imagine having reboot in the game would be revolutionary.,Positive,0.9699081182479858
7370,LeagueOfLegends,Negative,What,Neutral,0.5307366251945496
565,ApexLegends,Neutral,"If they let us cancel the jump, if we are thrown out, I will cry tears of joy",Positive,0.43769553303718567
3766,Cyberpunk2077,Negative,"Damn.. First FF7 gets a month delay,. Avengers gets 4 months delay,. Cyberpunk 2077 gets 5 months delay,. And now Dying Light 2 has a delay that is just ""????."" Y'ALL THAT SCARED OF ISABLE?! https: / / t.co / 72aWKKPaPJ",Negative,0.8803077340126038
6589,Fortnite,Negative,Just switched from @FortniteGame to @MWModernWarfare bc epic has no clue what they are doing,Negative,0.7331838607788086
6618,Fortnite,Positive,"At the same time, despite the fact that there are currently some 100 million people living below the poverty line, most of them do not have access to health services and do not have access to health care, while most of them do not have access to health care.",Negative,0.8425197005271912
8603,NBA2K,Neutral,@NBA2K THE NEEDA... GET IN KOBE ON AT A COVER OUTTA AND RESPECT AND CUZ AINT WHO EVEN ONE OF MY ONE FAVORITE DE PLAYERS,Neutral,0.5290681719779968
4529,Google,Irrelevant,"Reason 999,999 not to google anything on this internet. I am now informed I have “Slipping Dog Syndrome” from finding a pain in my legs when sneezing. @DocEMurray https://t.co/TdJCymbddy]",Negative,0.8731683492660522
7380,LeagueOfLegends,Neutral,... Check out my video!,Neutral,0.6504814624786377
5533,Hearthstone,Neutral,HEY. I don'K t know if this anyone down here rememebrs me but here I'm restarting my stream. Hit my top with 200 in,Neutral,0.6775908470153809
9844,PlayStation5(PS5),Neutral,"com Don't buy your first PS5 until Oct. 1st 1 in Turkey as there's a single 1, 200TL sales tax reduction on the console after that stated date",Neutral,0.7194686532020569
6891,johnson&johnson,Negative,Holy fuck...,Negative,0.8340867161750793
11603,Verizon,Irrelevant,my mother warned me was this happening,Negative,0.572796642780304
12750,WorldOfCraft,Neutral,"to friends. 3.. 3 of 1 (Heartbreak) - Fear, sorrow, guilt, worry, bad/sad news, jealousy, abusive communication... Today: time between all wounds, should you find one... unofficialwowtarot.com.",Negative,0.5214046835899353
1668,CallOfDutyBlackopsColdWar,Positive,"This is almost as addictive as Bo2’s menu music...if not...better? DAM DAMN, it slaps!",Positive,0.8815300464630127
12658,WorldOfCraft,Negative,"Probably not the first person to say this but, The video “That Time an Accidental Plague Nearly Killed Everyone in World of Warcraft” being in my suggestions is a little eerie .  @TodayIFoundOut1 @SimonWhistler",Negative,0.5540675520896912
5657,HomeDepot,Irrelevant,"mm yes, as well Id fuck her right over there at the check out",Negative,0.8996657133102417
5368,Hearthstone,Neutral,"-700 elo on streak in hearthstone bg btw, love pack leader",Positive,0.9442113637924194
3147,Dota2,Positive,"Too many people play dota 2, and internet goes frenzy!!",Neutral,0.4542120397090912
9532,Overwatch,Irrelevant,Someone called me below 500 for being in high bronze. I think they greatly underestimate the Overwatch player.,Negative,0.8188279867172241
229,Amazon,Neutral,ve played this interesting quiz on Amazon - Try your luck for a chance to win exciting rewards amazon.in / game / share / gQS...,Positive,0.9402641654014587
3756,Cyberpunk2077,Positive,"I sweated in front of god @ CDPROJEKTRED and the team making @ Game great developers, they have always been so consumer friendly, especially with free content for Witcher 3, that we need to support more absolutely love them.",Positive,0.9881366491317749
6799,Fortnite,Irrelevant,Another satisfied customer dm 1 right to now is @hana42615155 10 $ - 100 $.,Positive,0.8032175898551941
5911,HomeDepot,Irrelevant,A raised undead god that doubles as terrain.,Neutral,0.7711355686187744
13181,Xbox(Xseries),Negative,"You're a shitbag of a special kind, aren't you?",Negative,0.9650273323059082
7267,LeagueOfLegends,Positive,Juumi is a super cool fucking cat. Bako is such a good person. Neeco is devilishly funny.,Positive,0.9602742195129395
9756,PlayStation5(PS5),Irrelevant,@ Ron2K if I was green in the park kicked me?!?!? What is it? You released this stupid ass before the 5th round so people would have to buy it twice.,Negative,0.9693967700004578
11380,TomClancysRainbowSix,Positive,Streaming to remote @Rainbow6Game ranked... 1.tv/selh..,Neutral,0.9164301753044128
10248,PlayerUnknownsBattlegrounds(PUBG),Irrelevant,i have failed to be a bbhl in all facts. i don't even know how to play pubg ugh fuck it,Negative,0.9777178764343262
3745,Cyberpunk2077,Neutral,The latest on Kibbon! news.dailykibbon.com/?edition_id=df… Thanks Thanks @jackhunter74,Positive,0.8163361549377441
7693,MaddenNFL,Negative,How does the graphics get WORSE.,Negative,0.9682531952857971
859,AssassinsCreed,Positive,My favorite Assassin's Creed fan moment. Seeing the great fallen land pirates from youtu. be / and Y2RQ8YkqeEU com via Richard @YouTube,Positive,0.9468516707420349
8838,Nvidia,Negative,latest NVidia GPU drivers suck for COD MW >> 442.59 fo sho,Negative,0.9182331562042236
1734,CallOfDutyBlackopsColdWar,Neutral,no lie i do miss the game but fuck do i hope a-lot of the shit we experienced in the Fresh and beta is fixed on launch,Negative,0.885825514793396
1425,Battlefield,Irrelevant,picture is @xMusti070 H someone is trolling people again......,Negative,0.7946017384529114
13199,Xbox(Xseries),Irrelevant,Leaked Water Packaging Confirms Power Existence against.... lowy.at/CA4Pu 11],Neutral,0.8702236413955688
10694,RedDeadRedemption(RDR),Negative,@RockstarGames I legit can’t open or set my fucking camp I’m red dead redemption you need to let gta die! And fix rdr2!!!I IT PISSES ME OFF THE THE GAMES BEEN OUT FOR A YEAR AND YOU HAVNT DONE SHIT!,Negative,0.966763973236084
5821,HomeDepot,Negative,"2016 Would have been a great deal this morning RhandlerR. . . After 40 min on various lines I finally had this item.. . However, when I asked about the battery and charger (which was advertised) but not with mower, I'm told they could not sell me the item. . . Wtf.. . Waste of time. pic.twitter.com/Cf41jfOWUU",Negative,0.6577086448669434
5521,Hearthstone,Positive,One of the true greats.,Positive,0.7989022731781006
1535,Battlefield,Neutral,"... Unpopular lists of opinions,. Apex is garbage... nd rewards non skilled in play,. Battlefield Team v was made much better than ever bf1,. Pubg is old and washed up just like call of duty,. You make of the world a better place,. Cats who are smarter than dogs,. And I'm non... essential,. New movies suck",Negative,0.5613072514533997
10839,TomClancysGhostRecon,Neutral,Just another manic Monday.,Neutral,0.6482686400413513
13002,Xbox(Xseries),Irrelevant,So I just woke up 10 mins ago myself and know I'm already winning!!!!,Positive,0.9583876729011536
4598,Google,Irrelevant,". I was absolutely like one of all those “ mfers here ”... with my pink satin moto in razor havin ass self, pretty sure my ringtone was named Sexyback.... as nooooo because it was called Tear you Apart by @shewantsrevenge. that song still still hits just as hard",Neutral,0.469829261302948
8331,Microsoft,Irrelevant,My cat’s asshole and my grandma made their onscreen debut in today’s Microsoft teams meeting.,Negative,0.6405121088027954
305,Amazon,Positive,@PAYBACKIndia WooHoo!!!. <unk> have awarded an Amazon e-Voucher worth INR 100 as Digital Rewards!!!..,Positive,0.9338353276252747
7848,MaddenNFL,Neutral,This was crazy disrespectful. The other QBs could see the field from the locker room,Negative,0.9053401947021484
1916,CallOfDutyBlackopsColdWar,Neutral,Shit people would watch this if it was a movie,Negative,0.776098906993866
10266,PlayerUnknownsBattlegrounds(PUBG),Negative,@PMOIndia @narendramodi @AmitShah @HMOIndia.. it must be banned via india. Fear of Many of the people stuck with their school and the second reason says that some part of and Profit of pubg goes to china...,Negative,0.7936806082725525
8586,NBA2K,Negative,bro what? .  lmaooo ima be mad as hell,Negative,0.9123864769935608
8557,NBA2K,Negative,@ NBA2K crappy ass fucking update made this game more ass than what it already was,Negative,0.9819325804710388
4413,Google,Neutral,"""Great fun from the very last."" Allison Allison on Google, updating her birdeye.com/the-siegel-law...",Positive,0.9484308362007141
1635,CallOfDutyBlackopsColdWar,Positive,Jet packs away in a “ cold war zone ” setting makes so much sense that i love it,Positive,0.9652450680732727
5214,Hearthstone,Negative,8 Incredibly Stupid Hearthstone Combos youtu.be / cyiWZ6UuU @ YouTube.,Negative,0.8354116082191467
3223,Facebook,Negative,"Facebook should call itself ""Liberal Sanctioned Chinese Propaganda."" I haven't been there since April 14 and found out today that I was alerted to a 30-day suspension, then my act was deleted! I just ""expressed"" my support, which I didn't organize. FU Sugar Puck..... oann.com / facebook-remov... https: / / t.co / jMopq6Dwxl",Negative,0.669082522392273
7250,LeagueOfLegends,Positive,. 7.,Neutral,0.6320215463638306
12800,WorldOfCraft,Positive,Fuck final fantasy 16. World of warcraft is still the best game in the world,Negative,0.36113375425338745
5811,HomeDepot,Neutral,Home Depot Co-Fund Bernie Marcus Point Out of Major Fill in Democratic's Plan To Tax The Rich (VIDEO) thegatewaypundit.com / 2020 / 02 / home-d... via @ gatewaypundit,Neutral,0.8223480582237244
472,ApexLegends,Positive,Now's that's a terrible start having a game!..,Negative,0.9262181520462036
9711,PlayStation5(PS5),Positive,"I'm team Xbox, but this design got really nice.",Positive,0.9766896963119507
6819,johnson&johnson,Negative,I suing Johnson & Johnson - my grandma died from ovarian cancer! She never put baby powder on us.,Negative,0.9303722381591797
1605,CallOfDutyBlackopsColdWar,Positive,"I’m happy with this change. Games have a beginning, middle and end. . . It’s all about flow. You should have to keep momentum to streak a second time, not depend on streaks to get you more streaks...",Positive,0.9197695255279541
1968,CallOfDutyBlackopsColdWar,Negative,I frankly don ’ t even know who has needs him to really hear this but black ops Cold War was supposed to not be extended for everyone till Tuesday 1 PM Eastern time why isn ’ t it not working... hasn ’ t been working out since midnight yesterday @Xbox @XboxSupport @ATVIAssist @Treyarch,Negative,0.8268130421638489
11962,Verizon,Negative,"@ VZWSupport I sent you guys a direct message about an issue with my iPad I bought from Verizon, Please check it",Neutral,0.585119366645813
5269,Hearthstone,Positive,"Hearthstone Shaman opinions:. -Really fun. -Really interesting. Land your deckbuilding decisions better than standard/wild. -Shaman feels overtuned compared to other classes (that hero character is overwhelming, to say at least)",Positive,0.883668839931488
5330,Hearthstone,Neutral,20 more wins for 1000 win Mage Portrait! Climb still in the Legends Leaderboard. Top 200 tomorrow?,Positive,0.8076046705245972
4202,CS-GO,Positive,OMFG LETS KY,Positive,0.5211640000343323
1243,Battlefield,Irrelevant,to,Neutral,0.553673267364502
5724,HomeDepot,Positive,RhandlerR thank you for the generous donation of hand sanitizer from Home Depot pic.twitter.com/yZs5ZFmJa2,Positive,0.9568962454795837
1110,AssassinsCreed,Positive,damn doped. It could actually resume,Negative,0.7551621794700623
3749,Cyberpunk2077,Neutral,. + This time: A Cyberpunk 2077 demake set in 1997 bit.ly/3a8uGIL https://t.co/jsEmzN5gKI],Neutral,0.8762285113334656
10128,PlayerUnknownsBattlegrounds(PUBG),Irrelevant,How Abhijeet Bhayya ur efforts is incredible and how way you try to satisfy our wishes are all good hope Please continue the same with the good health and wealth.. Love fron Hyderabad,Positive,0.9791104197502136
7249,LeagueOfLegends,Negative,I've never been this tierd in my entire life,Negative,0.5150994062423706
9238,Overwatch,Negative,".@PlayOverwatch please stop promoting the ""learning a new hero"" on the blizzard client unless you are gonna have an actual reliable source... @SPACEOW has better videos made on overwatch from 2018... these players you get to make these videos are so bad...",Negative,0.8491929173469543
12648,WorldOfCraft,Negative,Blizzard has been one of the worst companies in the video game industry of late. They continue to disappoint with the release of Warcraft 3: Reforged. Blizzard underdelivered in every category and continues to erode their credibility. traffic.libsyn.com/armstrongsmusi…,Negative,0.9726988077163696
10493,RedDeadRedemption(RDR),Irrelevant,There is nothing to fuck about the game,Negative,0.9069452881813049
11894,Verizon,Positive,"Congratulations to our client, Diego Scotti, CMO @ Verizon, for naming @ Adweek Brand Genius. pic.facebook.com / kilCPassn6",Positive,0.9753592014312744
2054,CallOfDuty,Negative,"At the same time, despite the fact that there are currently some 100 million people living below the poverty line, most of them do not have access to health services and do not have access to health care, while most of them do not have access to health care.",Negative,0.8425197005271912
2475,Borderlands,Positive,"Just played a gay wedding in Borderlands 3, feeling powerful.",Positive,0.7158179879188538
7601,MaddenNFL,Negative,Bro fuck madden 21 why does the game modes never work @EAMaddenNFL @EA can Raidernation329 on Xbox 1 get my refund please y’all been around for this long and still dealing with the same bs bugs get it together $60 every year is ridiculous if I can’t load in,Negative,0.9527727961540222
4600,Google,Irrelevant,"""SHAMAN Friday 17 July 2020.""",Neutral,0.9235565662384033
10632,RedDeadRedemption(RDR),Negative,"I really like the GOT environment because the photo mode in this game is better than in RDR2, but in this game it is easy to find the best open world ever made.",Positive,0.982842743396759
7226,LeagueOfLegends,Irrelevant,I played a game where a player has to go afk for the whole week because they took a freaking shit during the load screen and Their toilet started flooding and didn't notice until 15 mins into them game when their carpet under their feet decided to get wet... LoL players aren't even human.,Negative,0.9726970195770264
11596,TomClancysRainbowSix,Negative,@Rainbow6Game you know what pisses me you the most is that you can’t play this now that one understands no one does that it’s so hard to get a team team now,Negative,0.9389551281929016
7144,johnson&johnson,Negative,Source The same Johnson & Johnson that got recalled for their products causing cancer? pic.twitter.com/RLd26m6B7C,Negative,0.7418088912963867
7633,MaddenNFL,Negative,@EAMaddenNFL  do you guys even watch the actual game? Your ratings are trash af. Get @_TJWatt in that 90 club before release smh. @minkfitz_21 and Steven Nelson as well.,Negative,0.9062618613243103
1340,Battlefield,Positive,I miss battlefield 1942,Negative,0.6017742156982422
27,Amazon,Neutral,Still I often played myself this interesting quiz on Amazon - Try your luck for a chance to win exciting rewards through amazon. in / premium game / share / and g0R …,Positive,0.9450970888137817
8796,NBA2K,Negative,"That's it, instead of setting players up for the game",Neutral,0.5109439492225647
1017,AssassinsCreed,Positive,"I played Assassin's Creed Unity last year and just thought about how bad it really is about this game. SO MUCH of love went into it, but they just didn't have enough time to finish it. Absolutely terrible. Still, I hope Valhalla is as good as Black Flag.",Negative,0.9116649031639099
10728,RedDeadRedemption(RDR),Positive,"""But what really gets under my skin is the sweet melancholy that permeates every moment. Game is a return to a world that is already disappearing under the feet of heroes and that for us is long gone.""",Negative,0.6073988676071167
3786,Cyberpunk2077,Positive,I made it!!!,Positive,0.9242223501205444
635,ApexLegends,Neutral,was out being cute!!!,Positive,0.8983317017555237
9221,Overwatch,Negative,"overwatch is trash, fuck this game",Negative,0.9810576438903809
8031,Microsoft,Positive,@NibrasManna I tried out Microsoft TODO and I really like it,Positive,0.9819258451461792
3563,Facebook,Neutral,On Facebook Blog Pages that Support CrimeInc.com. And the Digital Censorship to Come. nl.crimethinc.com / 2020 / 08 / 19 / on-...,Neutral,0.789553701877594
6225,FIFA,Positive,"We back tomorrow from 10am, after playing with fifa grinding tables towards best weekend league!.. we finished out of stream raiding at @RickhullG have a great stream dude and its good friend luck in champs later!",Positive,0.9801328182220459
1608,CallOfDutyBlackopsColdWar,Positive,"In this environment, they were impressed by the footage.",Positive,0.852398157119751
1244,Battlefield,Neutral,It's a beautiful day here in Yorkshire,Positive,0.9858450889587402
11091,TomClancysGhostRecon,Positive,"The A lot of great streamers are live right now, a lot of good Saturday night content being put out. RhandlerR and I are live now! We will be all night grinding out  . .  twitch.tv/fathergazpacho",Positive,0.974738597869873
7005,johnson&johnson,Neutral,.  Johnson & Johnson Covid-19 vaccine study paused attributed to unexplained illness in participant,Negative,0.5574548840522766
11215,TomClancysRainbowSix,Negative,@Rainbow6Game why do I queue like that and that random gets banned the second our game begins.... And with an EU player(also a random),Negative,0.7423654794692993
1902,CallOfDutyBlackopsColdWar,Irrelevant,Finally!!!! Another Death time awaits Modern Warfare!! Oh happy days love happy days.,Positive,0.9468305110931396
2001,CallOfDuty,Negative,A @Activision my call of duty modern warfare crashes then when am I open warfare or any related multiplayer game. And I have updated on all drivers. I'm not able to contact your AI support as well now,Negative,0.8621702790260315
2523,Borderlands,Neutral,<unk><unk> was directing its ‘Borderlands’ movie engadget.com/2020/02/20/eli...,Neutral,0.911741316318512
11559,TomClancysRainbowSix,Neutral,It just feels bad... I just gotta keep grinding towards Diamond then soon.,Negative,0.7714940309524536
2788,Borderlands,Neutral,Scumbag CEO Randy Ben Pitchford 2016 Screws Gearbox Devs On Track Bonuses Despite Being Borderlands Tier 3 Success ama. mobi / 2016 watch. php? vid = 16 …,Negative,0.5066826939582825
8115,Microsoft,Neutral,Microsoft wants the Xbox Series X to be the most backwards compatible console ever mobilesyrup.com/2020/05/28/mic… https://t.co/L2AuBgo43E,Positive,0.8800349235534668
8555,NBA2K,Negative,@NBA2K yall got yannis apple in yall mouth or some????,Neutral,0.6762611269950867
5612,HomeDepot,Negative,of months in... No reports about these people w Covid.. No breakouts at grocer at Home School or WalMart... Fake. Hoax. You<unk>.,Negative,0.7681886553764343
4515,Google,Positive,I love when my own clients show up in my insta and google ads just cause I visit their sites a lot. waste those ad dollars bitch,Positive,0.6977110505104065
10779,RedDeadRedemption(RDR),Positive,Clint Eastwood would be the perfect director for Red Dead Redeemption 2. The main story is perfect for an unapologetic Western style.,Positive,0.9456595182418823
11217,TomClancysRainbowSix,Neutral,Sorry all there is no live stream tonight having a lot of internet issues and won't be able to keep the stream going. .,Negative,0.8668129444122314
