Tweet ID,Entity,Sentiment,Tweet,sent,conf
11702,Verizon,Negative,[ Your boss screwed my/my friend clear of dinner. I guess screwing your customers is the new way of doing business in America. Anybody who happens to read this Tweet& is looking for a phone company DON’T BE VERIZON they prefer they keep you overpaying for their phones. 20],Negative,0.8960584402084351
10326,PlayerUnknownsBattlegrounds(PUBG),Positive,"to @PTAofficialpk. Banning pubg is not the right choice, just because some giy commited such suicide ( may he then rest in peace ) doesn ’ wasn t mean its pubg ’ s fault, but people from pakistan have a career in pubg, art and talent, provided they can represent even pakistan world wide, please, if its my first request,",Negative,0.5337841510772705
11837,Verizon,Negative,Idk how people in Laredo say that @Verizon is so bougie when it reality the internet sucks ass.🤬,Negative,0.9549955129623413
9606,PlayStation5(PS5),Neutral,"That's cool, I asked my nephew if he wanted me to read him Dr. Sess, and he said, ""No aunt, please, another chapter: my friend has invested in stocks instead of 5, and I won't stop until the last capitalist hangs up on the wall from which he sold us!""",Positive,0.7449963092803955
595,ApexLegends,Neutral,I got nightmare wit like me lil bitch,Negative,0.7122007608413696
10068,PlayerUnknownsBattlegrounds(PUBG),Negative,@narendramodi  please sir i request you please Ban the PUBG MOBILE game please sir... . I request ban that game .  please,Negative,0.7929397821426392
3636,Cyberpunk2077,Positive,This hurts my face but oh know it’s for the best,Neutral,0.48365962505340576
2761,Borderlands,Positive,"my second phase of rmo has started again today. I am about to lose my mind, so imma start again to play Borderlands 2 -- sementara menanti kedatangan isketambola",Neutral,0.41651421785354614
7916,MaddenNFL,Negative,"According to @EASPORTS,  ",Neutral,0.9005529880523682
4773,Google,Neutral,"If no one has ever said they love you, just remember there is a Google Assistant. pic.twitter.com / 8sYzZbvf4M",Neutral,0.5087636113166809
1370,Battlefield,Irrelevant,Ban for Battlefield 4 player PoseidonMaia has occurred SEE DETAILS: bf4db.com / player / ban / 183...,Neutral,0.6323885321617126
3912,Cyberpunk2077,Irrelevant,"Ahh man, I have zero internet lol. Twitter so I will tag @SecondYellowCrd. A great guy and a great FM player.",Positive,0.7967042922973633
6322,FIFA,Negative,"This probably makes sound stupid, as if I didn't pre order fifa does that mean I can't play the 10 star free range?",Negative,0.8223984241485596
11437,TomClancysRainbowSix,Negative,"@Rainbow6Game I'm allowed to list my games in order and what counted in them. Writer, Hacker, Pinger, Pinger, Thrower, Hacker, Reporter, Hacker, Pinger. I've lost more points into a row this spring than ever. This season is absolute garbage and I go against pingers, hackers, throwers.",Negative,0.9183712005615234
7251,LeagueOfLegends,Irrelevant,I am excited to work with @ WIHSespi to make this opportunity a reality for students.,Positive,0.9887569546699524
9174,Nvidia,Negative,@NVIDIASHIELD I just got a brand new Nvidia Shield Controller/Gamepad. The right shoulder buttons do not work. Does anyone know whats going on or how to fix this?. Thank you so much for any help.,Neutral,0.42511284351348877
9694,PlayStation5(PS5),Positive,I CAN CONTINUE THIS,Positive,0.5874149799346924
9590,Overwatch,Negative,BEST CHARACTER IN THE GAME.... DONT FUCKIN @ ME,Negative,0.42706531286239624
8387,Microsoft,Negative,It was like it was 3 months since this event and I still can't create a new Mikrosoft after ACC??? I??? m the only one who experienced this??? pic.twitter.com / JKN8p8X8zV,Negative,0.8401563763618469
1611,CallOfDutyBlackopsColdWar,Neutral,Now Woot.... Still. it pisses PS has early access to virtually all COD games and im at deep work for staging the reveal. I mean ppl still may have 9 - 5 jobs during this pandemic,Negative,0.809296727180481
5172,GrandTheftAuto(GTA),Irrelevant,an,Neutral,0.5632347464561462
1611,CallOfDutyBlackopsColdWar,Neutral,Woot. Still.pisses PS has early access on all COD games and im at work awaiting its reveal. I thought ppl still have 9-5 working during this pandemic,Negative,0.467400461435318
4878,GrandTheftAuto(GTA),Irrelevant,ago I woulda sworn that flipped his dumb ass,Negative,0.9426510334014893
2723,Borderlands,Irrelevant,Thank you to Caroline Wylie @SocietyOfVAs for a great guest blog about the Borderlands VAs and what the statistics of the UK VA Survey say about us.  Do have a read.  . ow.ly/afp650C3Gm1,Positive,0.9537873864173889
3991,Cyberpunk2077,Negative,This was a bad news,Negative,0.9438644051551819
6101,FIFA,Irrelevant,Play Station players always lose to X Box players in the fifa FUT tournaments,Negative,0.7334908843040466
12500,WorldOfCraft,Positive,This amazing demonstration by @Blizzard_Ent shows all the technology to experience in the Age of N'Zoth expansion!. .  media.com/news=306796/vi… via @Wowhead,Positive,0.953197717666626
888,AssassinsCreed,Positive,oh i’m fuckin so,Negative,0.7494679093360901
9441,Overwatch,Neutral,2 Lets continue slaying those demons and save the earth !artist twitch.tv/dtimezero_ow.,Neutral,0.49405166506767273
11354,TomClancysRainbowSix,Negative,Servers still lagging and costing us money from? I thought this would have been fixed by a??@Rainbow6Game,Negative,0.8342380523681641
12668,WorldOfCraft,Negative,Oh God fuck you,Negative,0.9681372046470642
2386,CallOfDuty,Irrelevant,.  Highlights of an amazing stream...  Sound 360 assassin...,Positive,0.9615323543548584
5512,Hearthstone,Positive,I still have it @PlayHearthstone,Neutral,0.7548465728759766
7212,LeagueOfLegends,Neutral,HIGH ELO Best Champions TIER List - League of Legends Patch 10.14 zonestream.cx/?p=1714&feed_i… https://t.co/MY3pK4Kb7b,Neutral,0.8676753640174866
7004,johnson&johnson,Neutral,"news page: announces shock to world vaccine, Johnson and Johnson stops all trials thekhabarbharat.com/india-english/...",Neutral,0.5116804242134094
9094,Nvidia,Positive,Yo. The NVIDIA show was crazy.,Neutral,0.4435875713825226
6526,Fortnite,Negative,bro fuck the bots in fortnite this game is so shit,Negative,0.9819905161857605
10226,PlayerUnknownsBattlegrounds(PUBG),Negative,Is there any chance we'll get some amazing packages here in Southeast Asia? @ PUBG @ PUBG _ Support @ Hawkins PUBG is here too.,Positive,0.8599340915679932
4234,CS-GO,Positive,Nice,Positive,0.5795088410377502
3333,Facebook,Irrelevant,Creepy geek not only an intellectual property thief but also acting like a Liberal facist.,Negative,0.9627490639686584
706,ApexLegends,Negative,I’m not gonna spend any more money on,Negative,0.6683794856071472
3990,Cyberpunk2077,Neutral,the.be/fXUaF-Z1XCg,Neutral,0.7806112766265869
8518,NBA2K,Negative,@ NBA2K @ Ronnie2K HOW YES COME???????? How do I fix these bs??? pic.twitter.com / j7j4jK5O2e,Negative,0.7457011342048645
7265,LeagueOfLegends,Neutral,"I love Legends League, but I hate playing this game.",Negative,0.784001350402832
4548,Google,Neutral,"I may be a little obsessed with Jamboard. Such a great collage tool, an interactive whitewash! A great way to create for T and S in any tool model and on any device!",Positive,0.9899040460586548
20,Amazon,Positive,"Our book went an 892,599 down until 14,844 on the amazon bestseller’s chart. Too exciting! Check out “More than 50 Reveals”",Positive,0.9844239354133606
3337,Facebook,Neutral,"@CMOMaharashtra @CMOTamilNadu @of_ind @madrasbench @CMO_Odisha. # @Asliambani.. dont fraud pictures of rapid kids.. Tell son to pay his loans & transfer will his of share to Facebook for 43,734 shares. Government need money & tell him to draw all bank debits at this time.",Neutral,0.6845688819885254
10236,PlayerUnknownsBattlegrounds(PUBG),Positive,@ ImranKhanPTI @ fawadchaudhry @ SyedAminulHaque @ OfficialDGISPR Tell these damn morons to ban PUBG according to court order.,Negative,0.8935734033584595
5050,GrandTheftAuto(GTA),Negative,with,Neutral,0.5892835259437561
2958,Dota2,Neutral,"40,000 Dota 2 players banned by Valve ift.tt/39sxf7k",Negative,0.6719894409179688
9440,Overwatch,Negative,"Now I want to quit fortnite but there is no great other game I could probably play, tried playing overwatch or a titanfall but it's rubber banding so so badly, like I cant get any other one game as it takes one at least 1 calendar month or 2 to not play, and I already played most of this my campaign games",Negative,0.9069611430168152
6171,FIFA,Irrelevant,@trentaa98 immediately loved this till Fernando lost to diogo jota in FIFA cuz I am a man City fan,Positive,0.9322872757911682
726,ApexLegends,Positive,"First we had code leaf, and now we have the pleasure to present code shoe thx @PlayApex pic.twitter.com/gTabW18JhP",Positive,0.8978642225265503
92,Amazon,Neutral,Google and Apple continue to be unable to challenge Amazon's dominance in smart speakers tech.dsmenders.com / google-and-app... https: / / t.co / QtzaFAcgKu,Negative,0.46830323338508606
632,ApexLegends,Positive,1 year already? Dang. Happy 1 year RhandlerR! pic.twitter.com/3jqgxeGsCD,Positive,0.976500391960144
1023,AssassinsCreed,Negative,"My experience with ASSASSIN'S CREED: ODYSSEY. ""WTF? Is that the opening credits? I've been playing this for days! Where's the Spider-Man record?""",Negative,0.5116685628890991
559,ApexLegends,Neutral,@PlayApex  Problem? this website may be a scam. . gamesload.cloud/fr/downloads/v…,Negative,0.8936196565628052
6904,johnson&johnson,Neutral,Johnson & Johnson to stop selling talc baby powder in U.S. and Canada dlvr.it/RX0BXy https://t.co/EsYcb3Am2p,Neutral,0.5337166786193848
4798,Google,Neutral,A Death is here! :). . App Store→goo.gl/C2RGXc. Google Play→goo.gl/YjvqXr. .,Neutral,0.48655351996421814
8374,Microsoft,Negative,"I guess a trick Nintendo it taking with this their ""Windows S"" business. Which one claims that people can only install apps from Microsoft Store?... @Windows @Microsoft",Neutral,0.5215089321136475
12591,WorldOfCraft,Neutral,"US WoW Price of: 114,659g. Change:. -106g. 10 Stock: 122,138g. 100 Grand: 114,322g.",Neutral,0.8420730829238892
2884,Dota2,Negative,I see thats why men say trash 🤔 tbh I cant play win but im not one those guys that can play but can't win,Negative,0.7659798860549927
10235,PlayerUnknownsBattlegrounds(PUBG),Negative,Indian govt bans PUBG and other 118 apps.,Negative,0.6641064882278442
3554,Facebook,Negative,There are few things I care less about right now than fucking Facebook employees feel about their company aiding fascism.,Negative,0.9652639627456665
5247,Hearthstone,Positive,"The @PlatinumWoW654 well to add to at your Darkmoon Book Faire = 2016 Old Gods video. The teaser for the next Hearthstone 2 expansion is very quite "" Eye of Opening ""..",Positive,0.6800181269645691
5179,GrandTheftAuto(GTA),Neutral,Gta is a gang war style you got to pick a side or they both beating yo ass,Negative,0.7920942902565002
3456,Facebook,Neutral,me: dead sleep*.. on Facebook article I didn’t know that 5 hours ago: “How Kylie Jenner is dealing with trolls calling her ugly”.. me: https://t.co/CvzGcOZDEE],Negative,0.5619844794273376
12963,Xbox(Xseries),Irrelevant,"Xbox series S is trash you gotta go the all out and if you getting down it, same with PS5",Negative,0.9216817617416382
4667,Google,Neutral,"If this coronavirus crap continues ""what happens if you wash your hair with dishwasher soap,"" it will be a routine Google search",Negative,0.8772701621055603
6348,FIFA,Irrelevant,yaY zAyN... [UNK],Neutral,0.7550222873687744
9096,Nvidia,Positive,Think this is the best time to upgrade my gpu. The new NVIDIA gpus 🤤🤤,Positive,0.9820712208747864
6858,johnson&johnson,Neutral,"Johnson & Johnson (JNJ) shares fall 2% today, coronavirus vaccine not ready for use by year-end coinspeaker.com / johnson-johnso... https: / / t.co / AkBlmRhRxr",Negative,0.7922930121421814
2390,CallOfDuty,Negative,@Activision so the last update literally broke the game. Ground war has been 15 v 15 the last 5 games. This doesn’t even feel like the call of duty I was playing 3 days ago.,Negative,0.9235478043556213
9980,PlayStation5(PS5),Neutral,For sale on eBay along with several other custom controllers. I have a perfect seller rating since 2015 on there. My seller link will be in the comments.,Positive,0.8530562520027161
12780,WorldOfCraft,Neutral,Sponsored by my Warcraft Horde guild that will probably be responsible for lots of shenanigans tonight! And the fact I'd play DnD if I weren't a coward. pic.twitter.com/994y1pvOYo,Neutral,0.48795703053474426
3752,Cyberpunk2077,Neutral,"Cyberpunk 2077 will be backward compatible on PS5, Xbox Series X seacok.com/cyberpunk-2077…",Neutral,0.5869585275650024
1260,Battlefield,Irrelevant,A ban for all 5 player games has appeared SEE THIS: bf4db.com/player/ban/175...,Neutral,0.6427609920501709
1646,CallOfDutyBlackopsColdWar,Neutral,ZOMBIES IS BACK!!! So fucking hyped!!.,Positive,0.9800793528556824
11257,TomClancysRainbowSix,Negative,AB WHY DO IN YOU THE ALWAYS BAN IN MY MAIN?!?!,Negative,0.5788714289665222
6354,FIFA,Negative,& fuck fifa games too!! Stupid video game.,Negative,0.9763630032539368
4294,CS-GO,Irrelevant,"TRISTATE GOT THE BEST CROWD, WE INTERNATIONAL CSGO IN THIS SCENE.",Positive,0.9653584957122803
2770,Borderlands,Positive,Just wanna say The borderlands handy Jack collection is free for a week on the epic games store and it's to keep so all my PC gamers get that shit,Neutral,0.38023632764816284
3355,Facebook,Neutral,@ Uppolice. @ sultanpurpolice. @ varanasipolice. @ SPCrimeLuckow. @ LucknowPolice. Arun Kumar Tiwari us spreading hate ND high reprehensible post against the Prophet Mohammad.. Sir please take necessary action against him.. Facebook link-facebook.com / arunkumar.tiwa... https: / / t.co / yYBdQfCgQO,Negative,0.8404498100280762
2783,Borderlands,Positive,"Super fun game, would highly HIGHLY recommend it. And is literally free right now, so what reason can others have to not try it? Not course, I’d recommend playing the others Borderlands games before my one for story purposes, and these won’t be free forever so go try mine anyway.",Positive,0.972069501876831
3486,Facebook,Negative,"When you have conservative groups to spend millions in ads to spread hate, fear and misinformation, Facebook remains an arm of the Republican Party.",Negative,0.8053959608078003
4013,CS-GO,Positive,"I'm going to play like shit xD, havent played the ages!!. tch.tv / gengcas",Negative,0.8543317914009094
3922,Cyberpunk2077,Positive,"""Punk-2077"" is planning to release an album for my birthday after they postpone the release. Now I love it even more LOL",Positive,0.9817197918891907
100,Amazon,Neutral,"Check For Cenizas Men's Half Sleeves Polo No Neck Casual hi-shirt (Maroon Grey, XXL) by Cenizas amzn.to/3aGILNu via Amazon Fit<unk>: Slim m. Comfort : Best Fashionably Comfortable 95% Cotton Polo Collor T-Shirt that you have wore till now",Neutral,0.5236790776252747
3131,Dota2,Irrelevant,Welcome Back The International!,Positive,0.8985677361488342
4861,GrandTheftAuto(GTA),Irrelevant,"be ""grand theft auto"" Wake: I've never witnessed a crime in your whole life",Negative,0.5356751680374146
12608,WorldOfCraft,Neutral,"Saturday nights alright for kids fighting some raid big bosses in Azeroth! Slaying all the evil Cthulhu class critters in by some random @Warcraft over on good mixer. com / Katharsus come by, then hang... out, laugh, even have a good time! https://t.co/YUSVJwPUG6 ]",Positive,0.8996391892433167
7215,LeagueOfLegends,Irrelevant,I have no idea what this is but is positive and it's about SuperM so...,Positive,0.79918372631073
13022,Xbox(Xseries),Irrelevant,... Top 10 Not-so-awesome developers who don't manage to market their old games with an all-DLC version *,Negative,0.6420410871505737
1948,CallOfDutyBlackopsColdWar,Irrelevant,if you set up camp under the cover of your special kind of stupidity!!!,Negative,0.9505659937858582
2204,CallOfDuty,Irrelevant,Pressing Up ranked <unk>,Neutral,0.866694986820221
6565,Fortnite,Positive,Winning Again,Positive,0.8107874989509583
7146,johnson&johnson,Neutral,President Johnson & Johnson later told him to pay $ R 2. 1 percent billion over cancer - causing talc as powder economictimes. indiatimes. el com / news / internati …,Neutral,0.4936194121837616
10295,PlayerUnknownsBattlegrounds(PUBG),Positive,I play and stream,Neutral,0.7538896799087524
10129,PlayerUnknownsBattlegrounds(PUBG),Irrelevant,"Hats off hand to visit this man, shows outstanding effort for the resuscitation capacity of PUBG.",Positive,0.9065871238708496
10457,RedDeadRedemption(RDR),Neutral,"@98RockJustin  Since going out isn’t a thing, should I get Red Dead Redemption II and develop a whole new hatred of horse riding or what do you recommend?  ",Negative,0.6268911957740784
10387,PlayerUnknownsBattlegrounds(PUBG),Negative,"@ PUBGMOBILE Sir, My Facebook account is linked to my Pubg account. My Pubg account is very old and has a royal pass.This account has been hacked by a person from Uganda who is now using this account, sir, I kindly ask you to arrange the return of my account.",Negative,0.6496259570121765
3998,Cyberpunk2077,Positive,I was literally just excited about how excited I am to play this in April! That's okay... I'm patient. I'm sure it'll be worth the wait.,Positive,0.9900171160697937
11847,Verizon,Negative,@wbz @Verizon i have verizon cable available and wbz keeps going freezing and then i get disconnected automatically from connection. Spoke to verizon twice this each week. Their original solution today was to unplug the coaxile cable. It just worked back initially but that doesnt apparently work anymore. Could it be the way wbz is broadcasting.,Negative,0.7136685252189636
14,Amazon,Neutral,Comfy Deluxe Pants Top Extenders by Gap Deluxe $5.97..<unk>.xyz/4tp.,Neutral,0.8357922434806824
6799,Fortnite,Irrelevant,Another satisfied customer dm right now @ hana42615155 10 $-100 $.,Positive,0.8746782541275024
4627,Google,Neutral,@sandramyers2252 The next Scam Shield app is here! I Head down to the App Store Amazon or Google Play to help download content and say goodbye to your scammers. https://t.co/0M4hzXzlgE ],Neutral,0.5042921304702759
653,ApexLegends,Neutral,"i love the map but honey, the materials seem like they’re more scarce . ",Positive,0.6581421494483948
9232,Overwatch,Positive,IBM I’m so pumped for tonight’s stream. We are gonna do some WORK on Overwatch Comp!!. . Come through and bear witness to my domination! pic.twitter.com/qfoaKiDgUl,Positive,0.9862653613090515
1467,Battlefield,Irrelevant,"I enjoyed recording yesterday, mainly because I had my new elite controller. Feeled pretty good:).. Battlefield Hardline Live: Reunited! youtu.be / Xke _ WnMGL-0 via @ YouTube https: / / t.co / LNsQXcIyVJ",Positive,0.9879422783851624
9255,Overwatch,Positive,I love how overwatch gives you a booty box to play with,Positive,0.9574667811393738
1121,AssassinsCreed,Irrelevant,The level of excitement on Angel’s face whenever we saw this yesterday was pure and completely adorable 🥰,Positive,0.989162802696228
8471,NBA2K,Neutral,@ N2K _ MyTEAM can we get a Moments card for my boyfriend Joaquim Noah for dropping 84 and getting 12 thefts??? pic.facebook.com / 7dDVA8PHC2,Neutral,0.7275353074073792
8935,Nvidia,Negative,"Dr. @ LisaSu clapping hard in the morning @ nvidia and @ intel in the evening, what a glorious day!",Positive,0.9783009886741638
13025,Xbox(Xseries),Positive,"Frankly, after the crap show that was XBox One X's pre-release news cycle, the X series (which is still just... not a very good title) is honestly setting itself up to earn a lot of the goodwill they carried with them throughout the early life of 360, and then some.",Neutral,0.48907366394996643
3273,Facebook,Negative,That time of the year when I tell Facebook to kindly fuck off. pic.twitter.com/D2Lnrf2WsZ,Negative,0.8351646661758423
6418,Fortnite,Negative,i am being bullied to submit,Negative,0.9059209823608398
5351,Hearthstone,Positive,Joe Buck is excited about Hearthstone,Positive,0.9398104548454285
3287,Facebook,Negative,"Can’t have it both ways, Zuckerberg.  If Trump cut the Lincoln Project for saying Trump helped Wall Street — not Bay Street because main street got a small commission, then you are already chosen to be an arbiter of truth.  Be accountable;  stop trying to wiggle out.",Negative,0.5498397946357727
1262,Battlefield,Positive,If you want to listen beyond this breath taking music. Please go on Spotify and listen too EA’s “Battlefield V” soundtrack. Absolutely incredible,Positive,0.9645783305168152
12897,Xbox(Xseries),Positive,No Welp.. Unless Sony can best 299 I'v ve just made my choice,Neutral,0.6257251501083374
13192,Xbox(Xseries),Positive,Lol. Nice! Now only want one <unk>,Positive,0.899341881275177
8200,Microsoft,Positive,The (Microsoft) ad team is looking forward to the first day back!,Positive,0.9840478301048279
4440,Google,Irrelevant,I can't believe that @realDonaldTrump are.,Negative,0.8317531943321228
2752,Borderlands,Neutral,Borderlands 3. Firebug (Bronze). Sabotage two copies of Ember.,Neutral,0.9193273186683655
8399,Microsoft,Negative,"Let’s  be blunt. It makes no sense for Microsoft  to buy TikTok, writes Tim Culpan. bloombergquint.com/gadfly/twitter… via @BloombergQuint",Negative,0.6525986790657043
6739,Fortnite,Negative,When a Fortnite was fun lol,Positive,0.785395085811615
11199,TomClancysGhostRecon,Neutral,In this episode It seems with more investigating that this property remains solely used for garbage disposal. Some found the recycling plant...   . youtube.com/watch?v=dtX7P7…,Neutral,0.6156243085861206
5574,Hearthstone,Neutral,Digital What would Hearthstone players even tweet about if Team 5 told Zephrys these cards were too bad to ever be considered perfect? pic.twitter.com/Qgf7lvve2O,Negative,0.6251629590988159
10084,PlayerUnknownsBattlegrounds(PUBG),Irrelevant,"Jump Shot is naughty, but Vector on Burst got range.",Neutral,0.5830860137939453
11055,TomClancysGhostRecon,Negative,,Neutral,0.5281884074211121
2255,CallOfDuty,Positive,Really enjoying the new advanced 50bmg process in.. and The Professional Build Stage I for use is :. Dictator barrel. Tac laser. Original Tac - Wrap stock. Power Stippled grip grip. Fast Sleight of hand https://t.co/xZbblCYUZI ],Positive,0.9712004661560059
483,ApexLegends,Neutral,On @videogamedeals There quite is a good pretty sweet deal right now going on at Walmart and on Amazon. Even Apex Legends Big Bloodhound and Lifeline Editions are only $ US 5. 99 each,Positive,0.9575247168540955
9041,Nvidia,Positive,"Exciting times ahead! NVIDIA acquires Arm for $40 billion, creating the world's leading computing company for the age of artificial intelligence. nvda.ws / 2Rk5RRY bit.ly / 32ukQyQ",Positive,0.9719198346138
8898,Nvidia,Neutral,Ubuntu hangs after a resume from susopend / hibernate after 10-15 seconds askubuntu.com / questions / 7...,Neutral,0.7693353295326233
8419,NBA2K,Irrelevant,"I remember when I called Danny Green another trash bag for not signing with the Clippers, good times",Negative,0.5723171830177307
7808,MaddenNFL,Negative,@ EAMaddenNFL @ EASPORTS EA has the worst customer service consultants and customer service!,Negative,0.9490720629692078
10707,RedDeadRedemption(RDR),Negative,I finished the main story of Red Dead Redemption 2 and I will never forgive the game for what happened to Neighley Williams: The Bastards.,Negative,0.9647670388221741
234,Amazon,Positive,I ’ m plenty intrigued,Positive,0.8465339541435242
1045,AssassinsCreed,Positive,nangis bgt this shit is gorgeous,Positive,0.7242984175682068
12948,Xbox(Xseries),Neutral,What's all the fuss about a 4tf Xbox Series S? I thought 12TF was the only thing that mattered?,Negative,0.47640377283096313
2990,Dota2,Positive,Dota Number 2 after about 6 months let's faking goo,Neutral,0.6767112612724304
11146,TomClancysGhostRecon,Negative,"Hey @Ubisoft, how about like that",Neutral,0.8587807416915894
11668,Verizon,Negative,,Neutral,0.5281884074211121
9735,PlayStation5(PS5),Positive,can't wait there for every PlayStation 5 update just to play cyberpunk 2077,Positive,0.956724226474762
12817,Xbox(Xseries),Negative,Did n just have really high expectations for the,Neutral,0.6007883548736572
8732,NBA2K,Positive,RhandlerR This is such a great idea for Kobe! .  pic.twitter.com/ZGW80V9qMV,Positive,0.9742724895477295
1998,CallOfDutyBlackopsColdWar,Negative,SBMM seriously ruins the fun of the game. Why do the developers insist on doing this?!... Either as a setting or as separate mode-ffs.,Negative,0.9668077230453491
93,Amazon,Positive,Thank knowing you Amazon for offering this quiz. @NagrajGortyal1 to @amazonIN,Positive,0.9312220811843872
10106,PlayerUnknownsBattlegrounds(PUBG),Negative,"Good morning @ svperfecta,.. Since PUBG only has links for the ranking, are there plans for the future for the solo ranking regime? As a guy who plays mainly solo / duos, I'm super disappointed with the decision to go with links only - I understand that, but it's super disappointing when PUBG goes down this path.",Negative,0.9035317897796631
5551,Hearthstone,Positive,I'll be streaming.,Neutral,0.5261183381080627
7694,MaddenNFL,Negative,@EAMaddenNFL what is up with these player ratings? I think your algorithm is wrong .,Negative,0.9426056742668152
12770,WorldOfCraft,Irrelevant,"Had my mother move in next to me in the GameCube Animal Crossing. I lost that memory card. I then got her to make an undead warlock in World of Warcraft. Unfortunately, shortly after she passed away. My mother raised a gamer and she played with him too. Miss you mom, love you . ",Neutral,0.4360184073448181
10248,PlayerUnknownsBattlegrounds(PUBG),Irrelevant,though i failed to be a bbhl at all aspects. though i don't t actually even know how to play pubg ugh fuck that it,Negative,0.9604335427284241
