Tweet ID,Entity,Sentiment,Tweet,sent,conf
6789,Fortnite,Irrelevant,He said told u I'm getting in that box of a brain dead controller player.,Negative,0.7037819027900696
4115,CS-GO,Positive,Yo this looks LIT! CS: GO / Overwatch combo,Positive,0.9670106172561646
5665,HomeDepot,Negative,@HomeDepot attention executive administrators. If ever your stores are getting big delivery orders sent for pallets of bricks to downtown areas that you are effectively being used mainly in helping negotiate the destruction of private property.,Neutral,0.6312699317932129
9369,Overwatch,Irrelevant,Guy has notified me and says that my name has been forwarded to a litter list lmaoooo get the fuck off overwatch you strange ass dude,Negative,0.9583767056465149
2476,Borderlands,Positive,F Loving the new DLC!!!. RhandlerR RhandlerR RhandlerR pic.twitter.com/PKZJxlGXLj,Positive,0.974492073059082
11558,TomClancysRainbowSix,Negative,@ Rainbow6Game out on Xbox,Neutral,0.8511818051338196
1207,Battlefield,Positive,you miss those Battlefield 1 days,Neutral,0.6426231861114502
10458,RedDeadRedemption(RDR),Irrelevant,lmao gamer jason could kill me for it,Negative,0.7862242460250854
4481,Google,Positive,"Most popular Google results in the previous hour:. 08/17/2020, 01:01:50. Europa League. Flash Arrow. Lovecraft Country. Antifa. Alex G",Neutral,0.581690788269043
4842,GrandTheftAuto(GTA),Irrelevant,thinkin’ about gta strippers rn.. About this one.,Neutral,0.8505457043647766
1377,Battlefield,Positive,"Awesome siege attempt... strangest spin out spinning sequence ever. My squadmate could see the spinning, which was bizarre..",Positive,0.7001227140426636
1762,CallOfDutyBlackopsColdWar,Positive,I'm waiting impatiently for the game,Positive,0.56421959400177
11993,Verizon,Neutral,"Verizon Sheds 81, 66 000 Pay TV Target Customers as Cord - Cutting Technologies Escalates on breitbart. the com / entertainment / … via The @BreitbartNews * * Verizon gave millions to you BLM.... show your industry support out to Verizon, KEEP... ON CUTTING THE CORD! * *",Neutral,0.5409448146820068
11633,Verizon,Positive,@ TMobile you guys are really slow in Tuba City. Az. Get people to go to Verizon.,Negative,0.8457661271095276
8639,NBA2K,Positive,to,Neutral,0.553673267364502
9255,Overwatch,Positive,I love how overwatch gives you a loot box for playing …,Positive,0.9654231667518616
9433,Overwatch,Negative,forgot i hated them,Negative,0.913128137588501
8651,NBA2K,Neutral,8 Who said internet was mad anymore about Dame getting the REGULAR cover like Kobe wouldn y ’ ′ t get a legend edition cover man. 7 The disrespect y ’ all showed Dame was flying wild. Simpletons of man lol,Negative,0.570020318031311
2210,CallOfDuty,Positive,Here's a montage of me saving my teammate @ SpreadLoveHXLY a few times the other day.,Positive,0.7148208618164062
1050,AssassinsCreed,Positive,Ezio will forever be in with my heart but this morning do be looking kinda lit by tho [UNK],Positive,0.8784215450286865
2592,Borderlands,Neutral,"5 games, 5 Mutuals.. Pokémon. Borderlands ( two p very much all ). Sims 4 ( haven't played in forever at tho ). Spiderman on PS4. This Spyro Reignited.. Uuuh I'm m not good at this either. @CiaranStrange to @Sasspiria 5 @orionsuccs 0 @msmarquise8. John Bleh",Negative,0.6969377398490906
10594,RedDeadRedemption(RDR),Irrelevant,Name your favourite:. . Videogame - Assassins Creed Revelations . Movie - Captain America The Winter Solider . Book - Touching Spirit Bear. Manga - I don’t read manga  . TV show -  Smallville . Superhero - Daredevil . Anime - My Hero Academia,Neutral,0.7028856873512268
1992,CallOfDutyBlackopsColdWar,Positive,be the lord!!!!,Positive,0.7895165085792542
7376,LeagueOfLegends,Negative,HOLI SHIT WHAT IN THE WORLD?!,Negative,0.9254817366600037
7421,LeagueOfLegends,Positive,Omg my Dreamcatcher x League of Legends is crumbling.,Negative,0.8515655398368835
305,Amazon,Positive,And @PAYBACKIndia WooHoo!!!. 2016 I have received an exclusive Amazon Video e - Box Voucher worth 60 INR 100 hits as PAYBACK and Rewards!!!..,Positive,0.9186630249023438
8551,NBA2K,Positive,If they don t ’ ′ t come out with a Kobe edition I ain on ’ t buying it,Negative,0.5788418054580688
6999,johnson&johnson,Neutral,"China Closes Foxconn, Johnson & Johnson, And Samsung Factories Amid Virus Outbreak  libertarianhub.com/2020/01/27/chi… https://t.co/cLTmh7bC2m",Neutral,0.5967922806739807
5793,HomeDepot,Negative,Spent just an hour at Home Depot: Home renovations as expensive as hell,Negative,0.8954544067382812
3701,Cyberpunk2077,Positive,Closer to my birthday.... I'm cool with this,Positive,0.9367721080780029
2480,Borderlands,Neutral,"I'm so tired of working this week that there's probably no border flow today, I'm SO SORRY.",Negative,0.9791825413703918
9928,PlayStation5(PS5),Positive,Its ok dont care nothing and charge me out 70 a game and for special patches too,Neutral,0.6195157170295715
130,Amazon,Neutral,Toxic masculinity makes me search for'male hair dryers' on Amazon,Negative,0.7642916440963745
7398,LeagueOfLegends,Positive,Playing  . :D,Positive,0.55201256275177
12751,WorldOfCraft,Negative,I actually mean midterms. But obviously it ’ s late and I also ’ m tired,Negative,0.7193992137908936
5390,Hearthstone,Positive,"$atvi ... the new update to one of their most popular games ""hearthstone"" is awesome. investors should be happy with the amount of things the company is doing to make the players (who are becoming more and more everyday) happy and keen on the game.",Positive,0.9912946820259094
12509,WorldOfCraft,Neutral,"Team JerseyBoys is now on Twitch... Welcome @ chucky _ CSGO... Our boss of trust offers you content from various games such as World Of Warcraft, CS: GO or Valorant on Twitch... Click here for the Twitch channel: tinyurl.com / y5gm9h74.",Positive,0.8228778839111328
5461,Hearthstone,Neutral,"Weapon sunsetting is the best feature I've heard in a long time. Most of you that play any multi season game with any strategy involved should know this is amazing. I can relate it to my days of playing MTG and Hearthstone.... This will bring more versatile, creative builds and",Positive,0.9857590198516846
10304,PlayerUnknownsBattlegrounds(PUBG),Negative,Problems:. -Rampant Sexual assualt in educational institutes.. -PIA Fake licenses.. -Baloch students arrested for protesting against inaccessibility of internet.. -215K corona cases & rising. -Christian man shot dead for buying house in Muslim majority.. Steps Taken:. -Ban PUBG,Negative,0.8977887630462646
2688,Borderlands,Positive,All 3 of these are me! I wore Tannis and Handsome Jack from...<unk>,Positive,0.5407194495201111
7331,LeagueOfLegends,Negative,"I want to report a racist who use filthy racism words to bully me in League of Legends game. This person's ID is ""Gotcha uWu xD"". I need chat history to keep this up, but  ",Negative,0.9332030415534973
8958,Nvidia,Neutral,"Each of the 20-series DLSS 2.0 graphics processors can run in 4K at speeds of more than 60 frames per second, according to Nvidia... pcg.com / au / death-stran....",Neutral,0.6802920699119568
1167,AssassinsCreed,Positive,Me : And I don t ’ t get how how my two year old can watch how them play same YouTube video ten times in a row and not get immediately bored. com Also me : Assassins Creed 12 What looks amazing!!!!!,Positive,0.667974054813385
10548,RedDeadRedemption(RDR),Positive,"Completed the latest Red Dead Redeeming 2 Legendary Animal (pre-Epilogue), well out in style. pic.facebook.com / Uyo0gBr2BD",Positive,0.6480534076690674
10353,PlayerUnknownsBattlegrounds(PUBG),Neutral,"..... Never does want someone to miss an update?. and Follow @informazio_ for Best Latest News Flash updates, Tech, All Covid - 19 Updates & Other Facts......",Neutral,0.597413182258606
5367,Hearthstone,Negative,@PlayHearthstone legit can you guys disable djinn ASAP. Only playing for one minion is as lame as it boring.,Negative,0.8943621516227722
6479,Fortnite,Irrelevant,"@ Scar4Playz @ ClouT _ Yapur @ DuNKi _ @ lenniydboyo... I love streaming, I can chat all game and make them laugh and still get W at the end, it was the only win I got in the whole stream, but I still think I won.",Positive,0.9741677045822144
4369,CS-GO,Irrelevant,It wouldn't be a party without you  . slink.bigovideo.tv/LWw0Vn https://t.co/8gJPBWZaly,Neutral,0.5753135085105896
2495,Borderlands,Positive,@Borderlands @DuvalMagic … I just wanted too say a huge thank you for all of them who worked and are working on borderlands and gearbox you’ve been crushing it enven more than before covid knowing how it must have been difficult so THANK IT.,Positive,0.9354409575462341
1404,Battlefield,Irrelevant,2010 I love Collectors Stuff  . Now I got the RhandlerR Blackshark Battlefield 4 Headset in Original Box complete and new (unused) . . RhandlerR RhandlerR pic.twitter.com/HVL7gYoAcg,Positive,0.9600781798362732
6157,FIFA,Negative,The biggest downshifter of FIFA 21 Downloads!. Collab w / @ FUT.,Neutral,0.6873986124992371
1202,Battlefield,Positive,waht a kill!!.   /. store.playstation.com/,Neutral,0.4786553978919983
6191,FIFA,Negative,It's like playing fifa against a five year old child. Absolute filth!,Negative,0.973444938659668
1287,Battlefield,Positive,,Neutral,0.5281884074211121
8115,Microsoft,Neutral,Microsoft wants the Xbox Series X to be the most backward console ever mobilesyrup.com / 2020 / 05 / 28 / mic...,Positive,0.8394198417663574
11889,Verizon,Irrelevant,gonna bet this is an epic hack!,Neutral,0.44128531217575073
6168,FIFA,Irrelevant,"Hudson-Odoi is so underrated he got a crisp 74 for FIFA 20, with an $80 million price tag.",Negative,0.519737958908081
4419,Google,Positive,Y’all ain’t help me with the bokchoy inquiry. I ain’t forget. .   I’m gonna google/you tube & cook it. If it’s nasty ..I’m cussing y’all out. in CAPS!,Negative,0.930341362953186
6014,FIFA,Irrelevant,Great piece of music from the Futbal legend. The only African to win the FIFA World Player of the Year award. George Weah our Prez. @ Blakkrasta @ zylofon1021fm,Positive,0.9608353972434998
10597,RedDeadRedemption(RDR),Positive,RT @ cragon _. 5 games in which I enjoyed myself the most:. Vampire: Masquerade - Bloodlines... Deus Ex: Human Revolution. Red Dead Redeeming. Lehman of Zelda: Breath of the Wild. OG Leisure Suit Larry (don't judge me)... @ fluffbrawl @ KwxKween91 @ itslexitaylor @ Jbird _ gaming @ wtty _ 12,Positive,0.862320601940155
13020,Xbox(Xseries),Positive,@ GAMEWrexham @ GAMEdigital has just received the email... play it safe and thank you for being awesome to the industry in the UK.... we will have a reboot in 2020 and the fantastic 9th Gen,Positive,0.9755896925926208
1720,CallOfDutyBlackopsColdWar,Negative,Still iffy about Europe,Negative,0.5564476251602173
7261,LeagueOfLegends,Positive,Malphite Shard of Skull Monolith is always a good pick... Attack:.. Armor:.. Magic:. ) Difficulty:...,Positive,0.8985834121704102
4956,GrandTheftAuto(GTA),Irrelevant,"At 12, I realized that I couldn't trust my friends when I had to disable MFker for not returning GTA: San.",Negative,0.8528866171836853
7394,LeagueOfLegends,Neutral,see RhandlerR is live once again playing some LoL make sure to check it out. This man streams won’t disappoint! twitch.tv/spflow .,Positive,0.9425168037414551
8884,Nvidia,Negative,Never in my life have I wanted to give a company $700 so bad but can't because the dang thing is never in stock. @nvidia plz,Negative,0.8939144611358643
8228,Microsoft,Neutral,"Bleepin: Fast forward to 2020, and Microsoft has released a security update to fix a mysterious ""flaw"" in Windows called CVE-2020-1464. No mention is made of who discovered the vulnerability on their official page.. portal.rc.micross.com / en-US / security...",Neutral,0.6059050559997559
11964,Verizon,Negative,Anybody in the southeastern Massachusetts area experiencing Verizon FIOS issues? We're getting Verizon service al the sudden.,Neutral,0.6083575487136841
9134,Nvidia,Neutral,"Nvidia's shares rises toward record high after Bernstein turns bullish, cuts price target on.mktw.net/32fX3kM",Positive,0.7186728119850159
11830,Verizon,Negative,And My whole state ( Alabama ) was blank to @Verizon,Neutral,0.6623523235321045
3168,Dota2,Negative,this the last time im wasting I my bloody time on dota 2,Negative,0.842105507850647
4922,GrandTheftAuto(GTA),Irrelevant,(NA / PC) Come Vibe With Me. Experimenting with GTA! twitter twitch.tv / milzzz _ ttd,Neutral,0.7100952863693237
1117,AssassinsCreed,Irrelevant,Hoist the flags i'm coming for You. Join me & tell me your best bits from the game. Which is your favourite? . . --> twitch.tv/direwolfjack11 <-- .,Neutral,0.6148794293403625
2676,Borderlands,Positive,"<unk>, yasss! Excellent snarly behavior! < 333",Positive,0.9519790410995483
2836,Dota2,Positive,nice nice nice,Positive,0.9311795234680176
7427,LeagueOfLegends,Irrelevant,@ vgdunkey is unlucky.,Negative,0.801069438457489
5645,HomeDepot,Negative,Online order collection at @ HomeDepot is the perfect way to,Positive,0.9481905698776245
373,Amazon,Neutral,@eLjeeeey Thanks for entering Grand Summoners .. Watch the video to see if you won a $100 Amazon gift cards! … Retweet everyday for another video to win!..... Play GS Global now for a FREE. 5 Golden Magic Unit!.  https://t.co/yLNBIXJDIi],Positive,0.8499236702919006
1210,Battlefield,Negative,,Neutral,0.5281884074211121
7591,LeagueOfLegends,Positive,playing in 0.3% league tile Clothing is SO enjoyable playing in 0.3% league tile Clothing is SO enjoyable playing in 0.3% league tile Clothing is SO enjoyable playing in 0.3% league tile Clothing is SO enjoyable playing in 0.3% league tile Clothing is SO enjoyable playing in 0.3% league tile Clothing is SO enjoyable playing in 0.3% league tile Clothing is SO enjoyable playing in 0.3% league tile Clothing is SO enjoyable playing in 0.3% league tile Clothing is SO enjoyable playing in 0.3% league tile Clothing is SO enjoyable playing in 0.3% league tile Clothing is SO enjoyable playing in 0.3% league tile Clothing,Positive,0.9493457674980164
10721,RedDeadRedemption(RDR),Irrelevant,There ya go fool @ RobLo _ Xero,Negative,0.5040363669395447
7038,johnson&johnson,Negative,I'm not sorry,Neutral,0.5629875659942627
5340,Hearthstone,Irrelevant,""" Life feels meaningless right back now "" he tweets, irritated after being a vile human man being. „ Good, again it is meaningless.",Negative,0.9368136525154114
11577,TomClancysRainbowSix,Positive,Happy to be back doing what I loved :)),Positive,0.986949622631073
8588,NBA2K,Negative,Nba tried to hurry up and remove it because it looks like the bookmaker is fucking his dog pic.fD3yUKYaHt,Negative,0.8384460210800171
6454,Fortnite,Positive,"This gets me happier as just finished watching, not all videos, but more than less and here'm glad zombies is back.",Positive,0.9847582578659058
738,ApexLegends,Neutral,Season 4 of,Neutral,0.7740282416343689
7181,johnson&johnson,Neutral,Thousands of plaintiffs give green light to talk lawsuit against Johnson & Johnson bharattimes.org / thousand-of-p...,Neutral,0.8474674820899963
7235,LeagueOfLegends,Negative,@LeagueOfLegends y'all should consider making changes to go with hextech skins. That might be a tremendous opportunity,Positive,0.873477041721344
2352,CallOfDuty,Negative,"Im thrilled with this game. Forget it, I will be watching very carefully for the next CoD. Nothing sounds better. Then again they only sound better till you play them. Modern Warfare 3 a worst Agent of Duty ever made.",Positive,0.6223322153091431
5001,GrandTheftAuto(GTA),Irrelevant,This kid is so talented at GTA it makes me wanna have an adult,Positive,0.9725955128669739
3137,Dota2,Neutral,So proud of my new toys...,Positive,0.9904417991638184
759,ApexLegends,Neutral,"The latest hero of ""Apex Legends"" is a master thief named Loba dlvr.it / RVnFXS https: / / t.co / ezLjauS691",Neutral,0.9094976782798767
383,Amazon,Positive,Ppl dead be rude to me just because I got an Amazon vest on...,Negative,0.8752983212471008
7776,MaddenNFL,Negative,Is MUT PC Servers Down? @ EAHelp @ EAMaddenNFL @ EASPORTS _ MUT Trying to Make Star Of The Day: Justin Jackson and keep getting the Madden 21 bug on PC via Stream pic.fm / kK1U0OXxxHB,Neutral,0.5367867350578308
6291,FIFA,Positive,,Neutral,0.5281884074211121
1871,CallOfDutyBlackopsColdWar,Positive,Sniper look smooth af on blackops cold war thank God.,Positive,0.8995465636253357
5672,HomeDepot,Negative,@GovRonDeSantis we have been to Walmart once this year. I haven't been to Home Depot. I find it ridiculous I subject our people at that at this time in the pandemic. People will die. Mandate school.,Negative,0.8721323013305664
10375,PlayerUnknownsBattlegrounds(PUBG),Irrelevant,"... If.. Not good news even for @MiIndiaSupport, already",Negative,0.8670518398284912
603,ApexLegends,Negative,@PlayApex I'm having issues with the game stuttering. Definitely got 2070 super i7 32 K dominator ram high-end motherboard dual m.2 drives. Anyone know why. Fully believe it's the PC.,Negative,0.4984491467475891
1929,CallOfDutyBlackopsColdWar,Negative,"At the same time, despite the fact that there are currently some 100 million people living below the poverty line, most of them do not have access to health services and do not have access to health care, while most of them do not have access to health care.",Negative,0.8425197005271912
10090,PlayerUnknownsBattlegrounds(PUBG),Positive,or Finally PUBG is being unban of in Pakistan.. i Thank you everyone who put their efforts in ensuring this.. Great decision by ISB for High Court..,Positive,0.8984392881393433
4596,Google,Positive,<unk>,Neutral,0.44890400767326355
3649,Cyberpunk2077,Irrelevant,the FF7 and Re3 are saved lol,Positive,0.6925333142280579
689,ApexLegends,Neutral,We need a third for the Ranking right now!,Neutral,0.7103567123413086
5441,Hearthstone,Positive,just saw @PlayHearthstone walking down the street to enter the tram how bold for a card game to use public transit. It's so humbling to see.,Positive,0.9432353377342224
220,Amazon,Neutral,I played this interesting quiz on Amazon - Try your luck for a chance to win exciting rewards amazon.in / game / share / g4G...,Positive,0.9450139403343201
1984,CallOfDutyBlackopsColdWar,Irrelevant,LETS FUCKING PEOPLE.,Negative,0.9728310108184814
7643,MaddenNFL,Negative,@ EAMaddenNFL Please in this next update y'all tune the Eagles line down. They haven't been that way this season!!!! Don't enjoy the game when you can just put on a chew watch and run after 4 stars,Negative,0.8189961314201355
3907,Cyberpunk2077,Positive,"At the same time, despite the fact that there are currently some 100 million people living below the poverty line, most of them do not have access to health services and do not have access to health care, while most of them do not have access to health care.",Negative,0.8425197005271912
6352,FIFA,Neutral,There also an ongoing trend for African clubs disrespecting FIFA international calendar. Could it be why it's frequency towards the end of the calendar year is disturbing or its down from the corona Virus protocols. Every club is manadated following FIFA Statutes to release players.,Negative,0.6372879147529602
8172,Microsoft,Negative,Project So RhandlerR say get a new PC. Even though I clicked my computer is lightening fast.. and I can have as many things open as I like ... windows 10 is a con. Fed up of companies being greedy! pic.twitter.com/dpXvC10TZr,Negative,0.6089578866958618
2157,CallOfDuty,Positive,"I'm in a terrible state of mind at the moment, but I have to say the event was brilliant. I'm super excited about what's going on with @ CallofDuty... Hopefully one day I'll be a part of what a thrill that was. pic.twitter.com / totuetHCye",Positive,0.9474228620529175
465,ApexLegends,Positive,feels weird to get a Victory in,Negative,0.694942831993103
4690,Google,Negative,the fucking google search at the top of this is sending me,Negative,0.8782468438148499
1368,Battlefield,Irrelevant,The Turn 4 Battlefield game of yoshistyles has occurred SEE DETAILS: bf4db.com/player/ban/170...,Neutral,0.8968331813812256
8401,NBA2K,Negative,"@NBA2K_MyTEAM D @NBA2K @2K I purchased that something from just you, and never received and your customer service says such its not their chief problem. Do or i need to immediately contact the better business bureau? This crap is ridiculous",Negative,0.9280182123184204
11249,TomClancysRainbowSix,Negative,"@Rainbow6Game @UbisoftSupport can you all plz fix this new game mode. The invisible/invincible glitch ruins the game. By all means be so good, but I can’t win anymore.",Negative,0.8145894408226013
4416,Google,Negative,"Let's all agree to completely destroy the inevitable Facebook, Apple, and Google ads that come out and show people high fives and hugs as soon as it's over.",Negative,0.5226781368255615
3177,Dota2,Negative,and,Neutral,0.537208080291748
6641,Fortnite,Irrelevant,The Best Way for Protect the Sharp LCD Note10+ buff.ly/2zkjIhU..,Neutral,0.5497710704803467
9317,Overwatch,Positive,this Bollo plant side here? i love aggressive overwatch along with twitter on it if its just mine to say,Positive,0.9638324975967407
2546,Borderlands,Positive,@ITalkFortnite Just bought Borderlands 3 from @EpicGames using your creator code! cant wait to see the skin!,Positive,0.9776685237884521
301,Amazon,Positive,I Can’t Wait Inside My Amazon Shipment.,Positive,0.7757986783981323
179,Amazon,Neutral,Amazon has just launched with a helpful face mask store at dlvrit. like wordpress. et com / on 2020 / 07 / 28 / ama …,Positive,0.8484467267990112
4396,CS-GO,Positive,Games I fucking love right now... These Gears 5. Rainbow Power 6. No CS : GO. Overwatch,Positive,0.9742554426193237
1271,Battlefield,Positive,"Every time EA Play runs, I remember a great moment when I showed up alongside so many influential community members in The We Are Battlefield 1: Thank You for our community video. ea.com / games / battlefi...",Positive,0.9814085364341736
12908,Xbox(Xseries),Irrelevant,The design and price of the Xbox Series S are reportedly revealed in a leaked video cnet.co / 3lVK9,Neutral,0.9084551930427551
2174,CallOfDuty,Neutral,Crazy kids with collateral damage for a QUAD IT/FURY WORLD...,Negative,0.8894398808479309
10662,RedDeadRedemption(RDR),Neutral,Huntin critters in Red Dead Redemption 2 twitch.tv/jon_solo24,Neutral,0.9110681414604187
2469,Borderlands,Positive,"Great casting for ""Lilit,"" the most anticipated film",Positive,0.984264075756073
6869,johnson&johnson,Irrelevant,"Oh, but we'll have a vaccine by election day... I'm sure it's pissing in Donald's KFC barrel today.",Negative,0.719986617565155
2059,CallOfDuty,Irrelevant,"If Covid19 has shown us anything, it was that amid conversations about crime & corruption, there are many stories of health workers going below & beyond the call of duty. Vote for them as @AccountLabSA's",Negative,0.4869087040424347
2100,CallOfDuty,Positive,@InfinityWard @CallofDuty best 7 classes on cod change my mind! Bet you can’t! Best Modern Warfare Classes As Seen in Call Of Duty League youtu.be/Kfu-pmnVUs0,Positive,0.746110200881958
9211,Overwatch,Positive,I love one man pic.twitter.com/IjOowLSVRt,Positive,0.9793499112129211
9819,PlayStation5(PS5),Positive,What will he say? Them graphics will compete with F5. U see it. Shit getting real T,Negative,0.6910808682441711
11303,TomClancysRainbowSix,Negative,"@ Rainbow6Game @ Ubisoft Why do I keep getting problems with dogmatic sound. Just as drones don't emit sound, I don't hear enemy steps, enemy fire sounds like it's coming from one direction when it's another.",Negative,0.901290774345398
4656,Google,Negative,i One will never understand about continuing to trust freedom hating thieves at both @google and @YouTube institutions for revenue.,Negative,0.8753170371055603
1338,Battlefield,Negative,is shit lol,Negative,0.7882631421089172
12484,WorldOfCraft,Positive,What a nice day outside!! Can’t wait to stay inside and play World of Warcraft,Positive,0.9891672134399414
9401,Overwatch,Negative,The worst character,Negative,0.9362339973449707
75,Amazon,Neutral,RT @ richardturrin: Amazon and Goldman Sachs partner. Perfect BaaS strategy!. thegcial.com / 92681 / marcus-g.... @ BrettKing @ leimer _ b _ dc @ ixconn @ UrsBolt @ cgledhill @ rshevlin @ thepsironi @ karunk @ spirosmargaris @ jaypalter @ efipm.,Positive,0.8828004002571106
8352,Microsoft,Negative,A little awww am shucks to take with you into a week of work using his Microsoft and Office products while trying to tame the wild beasts hiding in your house.,Negative,0.5664686560630798
1857,CallOfDutyBlackopsColdWar,Negative,Score streaks are the worst thing that can happen in Black Ops Cold War.,Negative,0.9700586199760437
11238,TomClancysRainbowSix,Negative,@ Rainbow6Game any tips on how to get black ice? Level 130 and still have none.,Negative,0.542020320892334
4062,CS-GO,Positive,"I had a lot more time to play @ PlayVALORANT today and the more I play the game, the more convinced I am that this game is the next big thing. It does what CS: GO does wonderfully, but it also has its own voice in the genre. It's not just a clone of CS: GO and I like that.",Positive,0.9738702774047852
6082,FIFA,Negative,"What ""Next Generation"" Will Play for a Damned FIFA",Negative,0.6886721253395081
1358,Battlefield,Positive,Battlefield 3 Remastered and a Rebooted Battlefield OMG that will be so cool one day,Positive,0.9857882857322693
8379,Microsoft,Neutral,Microsoft opens data on the threat of the corona virus to the public cyberscoop.com / microsoft-coro...,Neutral,0.8008916974067688
6218,FIFA,Neutral,Playing fifa with my girl.  She got her first goal against me and someone won’t shut out.,Neutral,0.5779253840446472
11340,TomClancysRainbowSix,Negative,RhandlerR  great game you got 🤣.  joke fix it pic.twitter.com/NXdB0i8yE7,Positive,0.6861006021499634
